{
    "$schema": "https://json-schema.org/draft/2020-12/schema",
    "$id": "urn:benchmark:complex-deployment",
    "title": "DeploymentManifest",
    "type": "object",
    "required": ["apiVersion", "kind", "metadata", "spec"],
    "additionalProperties": false,
    "properties": {
      "apiVersion": { "type": "string", "enum": ["apps/v1", "v1"] },
      "kind": { "type": "string", "enum": ["Deployment", "StatefulSet"] },
      "metadata": {
        "type": "object",
        "required": ["name", "labels"],
        "properties": {
          "name": {
            "type": "string",
            "pattern": "^[a-z0-9]([-a-z0-9]*[a-z0-9])?$"
          },
          "namespace": { "type": "string", "default": "default" },
          "labels": {
            "type": "object",
            "additionalProperties": { "type": "string" }
          }
        }
      },
      "spec": {
        "type": "object",
        "required": ["replicas", "selector", "template"],
        "properties": {
          "replicas": { "type": "integer", "minimum": 1, "maximum": 100 },
          "selector": {
            "type": "object",
            "required": ["matchLabels"],
            "properties": {
              "matchLabels": {
                "type": "object",
                "additionalProperties": { "type": "string" }
              }
            }
          },
          "template": {
            "type": "object",
            "required": ["metadata", "spec"],
            "properties": {
              "metadata": {
                "type": "object",
                "required": ["labels"],
                "properties": {
                  "labels": {
                    "type": "object",
                    "additionalProperties": { "type": "string" }
                  }
                }
              },
              "spec": {
                "type": "object",
                "required": ["containers"],
                "properties": {
                  "containers": {
                    "type": "array",
                    "minItems": 1,
                    "items": {
                      "type": "object",
                      "required": ["name", "image", "ports", "resources"],
                      "properties": {
                        "name": { "type": "string" },
                        "image": { "type": "string" },
                        "ports": {
                          "type": "array",
                          "items": {
                            "type": "object",
                            "required": ["containerPort"],
                            "properties": {
                              "containerPort": { "type": "integer", "minimum": 1, "maximum": 65535 },
                              "protocol": { "type": "string", "enum": ["TCP", "UDP"], "default": "TCP" }
                            }
                          }
                        },
                        "resources": {
                          "type": "object",
                          "properties": {
                            "limits": {
                              "type": "object",
                              "properties": {
                                "cpu": { "type": "string" },
                                "memory": { "type": "string" }
                              }
                            },
                            "requests": {
                              "type": "object",
                              "properties": {
                                "cpu": { "type": "string" },
                                "memory": { "type": "string" }
                              }
                            }
                          }
                        },
                        "env": {
                          "type": "array",
                          "items": {
                            "type": "object",
                            "required": ["name"],
                            "properties": {
                              "name": { "type": "string" },
                              "value": { "type": "string" }
                            }
                          }
                        }
                      }
                    }
                  }
                }
              }
            }
          }
        }
      }
    }
  }